# Name,Title,Complexity rating,Ability name,Charges,Type,Code,Ability,Special text,Starting Breach Positions,Hand,Deck,Special I,Special II,Special III,Special IV,Flavour,Box
Ilya (O),Right Hand,4,Life Embrace,5,M,,Cast all of your prepped spells without discarding them. Any ally returns a card in their discard pile to their hand.,,"0,2,3,3","C,1b4,S,S,1b5","C,1b9,S,S,1b11",,,,,"""How should one talk about Ilya? The most beautiful things defy description. She is like the warm, sure knowledge that the sun will rise tomorrow. Hope, eternal, even in this world that gladly kill us all. Ilya and I were paired together when we were kids, picked to be Tethers. I still remember the day we received our tattoos. We were holding hands and she looked me in the eyes, smiled so brightly, and asked if I could feel the magic. She said she had never felt so connected to the world and its aether. That she could feel it all flowing through her. I'd always thought of magic as something to fight with. A way to defend the village, to push back the Portalborn, to keep everyone safe. but in that moment, in her eyes, I saw what Ilya saw. Beautiful, magical currents of life coursing through us all. Connecting us to the plants and the animals and the stones and the water. Connecting us to each other. Whenever we hold hands now, I think of it again. The connection Ilya sees everywhere she looks. There is no one I would rather spend my life with."" - Kel",Outcasts
Kel (O),Left Hand,4,Soul Invigoration,6,M,,Return up to two gems or relics you played this turn to your hand. Any ally draws a card and may prep a spell in hand to an opened or closed breach.,,"0,4,4,4","C,C,1b14,S,1b15","C,C,1b19,S,1b21",,,,,"""Kel likes to think she's tough, but I know her a little better than that. Beneath that sour exterior is a soft and loving core. She cares more about Azer than any of us. She'd give her life without hesitation to defend every single villager, and I'm glad I get to be at her side making sure she doesn't have to. We've been fighting together, hand in hand, since we were little kids. I still remember the day we got our tattoos done. It was one of the best days of my life. She looked right in my eyes and promised she would defend me. That as long as she was at my side we'd go down together or not at all. She squeezed my hand tight and said it was the honor of her life to fight by my side, and I swear I almost burst out laughing at the serious expression on her face. But that's just the kind of person Kel is. She cares. About everything, with every fiber of her being. I'm so lucky that we get to spend our lives together."" - Ilya",Outcasts
Taqren (O),Severed Shield,6,Sustain,5,M,,"If you are not exhausted, gain 3 life. Otherwise, Gravehold gains 3 life.","On the left side of the front of the mat, there is a barrier track:#- Any ally draws a card.#- Focus your closed breach with the lowest focus cost.#- Gain 1 charge.#- Prep a spell in hand to one of your opened or closed breaches.##Place the barrier token on the ""Any ally draws a card."" space of the barrier track.#When Taqren suffers damage, or is exhausted and would suffer damage, move the barrier token to a different space on the barrier track and resolve the listed effect.#While Taqren is exhausted, Gravehold suffers 1 damage per 1 damage Taqren suffers instead of 2.","0,2,3,3","C,C,C,1b25,S","C,C,C,S,S",,,,,"I am optimistic, but that does not make me a fool. As soon as I heard talk of a traitor amongst the council of Elders, I knew it was my mother. She is my mother. I am not so ignorant that I could not tell something was wrong with her. I had hoped it would not be this dire, but that is the way of optimism. It does not always match up to the harsh truths of reality. The traitor mage, they call her. I do not like this term. My mother is misguided, yes. She made costly and dangerous mistakes, but she is not a traitor. She was the one who taught me that New Gravehold is nothing more than its people, and that defending them is the greatest endeavour of my life. She taught me that it is not enough to fight now, in the present, but that one must look forward to the future to ensure the safety of our children. Her ideas are radical, and her methods are flawed, but in many ways she is right. We cannot be content with tradition. We cannot become complacent in our old ways, not when there is a chance to do better. To pass on a safer, kinder world to the next generation. They should not have to live at war, as we have. Not if there's something we can do to stop it.",Outcasts
Z'hana (O),Crimson Rebel,3,Inscribe,5,P,,Gravehold gains 5 life. Place two glyph tokens on top of any card in the supply.,"Set all the glyph tokens next to this mat. When an ally gains a card with a glyph token on it, that ally or Z'hana resolves that token's effect. Then, that token is returned to Z'hana. When Z'hana gains a card with a glyph token on it, place that glyph token on any card in the supply unless you are playing with one mage. When a card with one or more glyph tokens is removed from the supply, return those glyph tokens to Z'hana.","9,4,3,1","C,C,C,C,1b36","C,C,C,1b40,S",,,,,"I won't defend myself. I won't make excuses. The people of New Gravehold can judge me if they wish. My reputation means nothing to me. All I care about is the safety of my people, and the future of humanity. No one loved Gravehold more than me. I spent my life defending it, and I am still defending it. My heart broke for everything we lost in The Fall. Our home, our people, our history. My Soren. Losing him there, raising Taqren without him, it's the hardest thing I've ever had to do. After we founded New Gravehold I cautioned Brama against exiling all of Xaxos's old students. I had just as much cause as any, more cause even, to hate Xaxos for bringing Maelstrom to Gravehold, but his followers had done nothing wrong. Outlawing the very study of the Void is tyranny, and nothing but a recipe for stagnation. If we refuse to learn from the mistakes of our past, we are doomed to repeat them. Brama and her traditions are only holding New Gravehold back. For the sake of future generations, we need to embrace new kinds of magic and move forward.",Outcasts
Qu (O),Destroyer,7,Combust Aether,4,D,,Draw three cards.,,"0,0,4,4","C,C,C,C,2b29","C,C,C,C,S",,,,,"I spent so much of my life desperate to escape the Void, it's odd to find myself returned. My new life in New Gravehold is so beautiful that I am almost afraid to touch it, as if it might shatter like brittle glass. I have people I would consider friends. I have a house that I am trying to consider a home. Taqren tells me it's normal to be nostalgic for a battleground. He says he too has dreams of the fearful weeks he spent running from Gravehold as the caves collapsed, hunted by Nameless with almost no protection. At least then he had purpose, clarity of direction. Now my bed is so comfortable, I don't feel like I belong in it. The people are so carefully kind, they avoid my monstrous half with practiced courtesy, and I know they are not ready. So I was almost relieved to follow my father's call and return to this dreaded place where everything is pain and fear and suffering, but it is at least a familiar pain. I know the shape of this pain, where it inserts itself beneath my ribs and settles. It does not try to hide behind honeyed words. I do not want to stay here, in this dark place. But maybe by the time I have returned, New Gravehold will be ready for me. Maybe I will finally be ready for it.",Outcasts
Thraxir (O),Reanimated,5,Shackles Unleashed,5,M,,"Cast up to three spells prepped by any players. If you have three opened breaches, those spells deal 1 additional damage. If you have four opened breaches, you may cast up to four spells and those spells deal 2 additional damage instead.",,"4,4,4,4","C,C,C,3b27,S","C,C,C,C,S",Forged Breach,Honed Breach,Refined Breach,Serrated Breach,"""It's been hard to get Thraxir's story from him, he recalls details sporadically and much of his human life is buried beneath years and years of bloodshed. It must be traumatic, coming back to yourself after spending so long as a mindless monster. The memory of hurting the people you once cared about... it can be easier to live without. This, at least, I understand intimately. Void essence is powerful, but it can drive you past the point of sanity. I'm ashamed to admit that I was conscious of what I was doing when I turned on my fellow mages and attacked them. It would be easier for me if I could hide in the fog of madness. I thought my cause was righteous enough, my goals pure enough that any action could be excused. Thraxir and I are both too far gone to ever truly belong in New Gravehold again. But perhaps together we can rediscover what it means to be human."" - Xaxos",Outcasts
Dezmodia (O),Void Risen,7,Void Vortex,4,M,,"Any ally draws three cards. Then, place any number of cards in your hand into their hand. Then, that ally places the same number of cards in their hand into your hand.","When Dezmodia is exhausted, she does not discard her Void Breach.","9,9,9,3","C,C,C,C,END56","C,C,C,C,S",,,,Void Breach,"Xaxos tells me they're calling it The Fall. My denouement. The crowning achievement of my life, to die and bring my entire civilization down around me. Impressive, I know. I've always been impressive. The child prodigy. Time is odd in the Void. It's familiar and strange all at once. From the day I was born, I knew what it would feel like to die, and now that I have died it fails to measure up to expectations. I suppose after spending a lifetime with it, even the pain of death can grow familiar. I lived my first life in the in-between of worlds, stuck between ours and the Void like a reflection of the stars caught in a pool. At least now my outsides match my insides. I can feel it humming in my teeth, the frission between universes. Each breach, each portal, they rip and tug at the uneasy balance between these worlds. Even I do not know what will happen when the seams unravel.",Outcasts
Arachnos (O),Redeemed Acolyte,3,Expunge,6,M,,Cast any player's prepped spell. That spell deals 3 additional damage.,,"0,0,3,3","C,C,C,END57,S","C,C,C,C,S",,,,,"The ritual was poorly conceived. There were flaws. Not the least of which was my own personal involvement. Power corrupts, it is often said. It is said less often that the corruption is not merely to the spirit, but also to the mind. Once I started down my path of discovery, I found myself more and more unwilling to stop. I eschewed safety protocols I had always held in the highest regard. I sacrificed my friend Karak to my ambitions, thinking my process ready for human trials. I listened to Karak screaming in the Void as the ritual aged him, melted his flesh, turned him into something grotesque and inhuman. But I would not stop. I hesitate to blame it all on the corrupting nature of Void essence, because that would excuse the greed and ambition that have always been embedded deep in me. I should not be excused. If this odd rebirth is a potential for a second chance, I do not intend to squander it. My mind is clearer than it has been in years. I already lost so much, my home, my friends, even my humanity. I do not intend to lose more.",Outcasts
Cairna,Flame Walker,4,Energize,6,M,,Gain a spell that costs 5$ or less from a supply pile. You may lose two charges to gain any spell from a supply pile instead. You may lose a charge to prep a spell in your discard pile to one of your opened breaches.,"Cairna's ability can be used when she has 3 or more charges. When Cairna uses her ability, she loses 3 charges.","0,1,2,3","C,C,C,C,16","C,C,C,S,S",,,,,"People lost a lot of things when the cave collapsed on Gravehold. For me? It was my legs. I didn't even see the piece of rubble when it came down. I blacked out for a lot of it. Luckily. I assume my family thought I died. I try not to hold it against them. You see your little girl half crushed beneath a building you don't assume she'll bounce back from that. I'm still not entirely sure how I did. I hadn't had any training in breach magic. I hadn't picked out a special rock or learned the sister-words or whatever initiates do. The mages keep it all very wrapped up in their world. Normal people like my family were never informed about these things. All I know is I woke up buried alive, needing a way out, and then the rocks responded to me. I don't question how it happened. I just know it saved my life. I made myself legs out of the stones that I thought would be my tomb, and I walked all on my own. There was no one left in the ruins of Gravehold by then. I've been surviving for years down here alone. It's not the best life, but I'm surviving. I've got my legs. I've got my strength. Let the world come crashing down again: I made it through once, I can do it again.",Return to Gravehold
Ohat and Ulgimor,Double Soul,4,Enrapture,4,M,,Ohat mode: Suffer 2 damage. Any ally draws five cards and discards two cards in hand.#Ulgimor mode: Cast a spell prepped to Ulgimor's IV breach without discarding it.,"Place the Ohat/Ulgimor token on the front of the mat with the Ohat side faceup. When you have 5 or more life, you are in Ohat mode. When you have 4 or less life, you are in Ulgimor mode. Flip the token to the appropriate side when relevant. When you become exhausted, do not resolve any on-exhaust effects. You can gain life when you have 0 life to become un-exhausted.","0,3,3,3","C,C,C,C,17","S,C,C,C,S",,,,Essence Breach,"I've never fancied myself a survivor, but fate had other plans in mind for me. And when I say fate, I mean Ulgimor. Back in the day, before this fragment of the Umbra Titan stitched itself to my shadow, people called me a coward. I even called myself a coward. You can't fault me for being honest about it. I didn't have big plans for my life. Never aspired to be much more than what I was. A simple dirt merchant. I figured getting bound to Ulgimor would be the worst thing that would ever happen to me, but that was before the entire city was destroyed. Now I'm glad he was there, he pulled us both through that, sheltering me from the falling debris and keeping me moving. It's funny, you don't really get to know the horrifying shadow monster attached to your soul until you're stuck underground with it alone for decades. Then it becomes almost comforting. The last vestige of who you once were. But I like who I am now, who we are. Together. We're stronger when we cooperate. Only took being on my own to realize that.",Return to Gravehold
Lucien,Water Weaver,7,Magnetism,5,C,,Open all of your breaches. Prep any number of spells in hand to your opened breaches.,,"0,1,1,1","C,C,C,S,55","C,C,C,C,S",,Channel Breach,Tide Breach,Flood Breach,"A single drop of water will eventually wear away the tallest mountain. It's inevitable. Unstoppable. It's the way of the universe. Every mage in Azer, when they begin their training as a child, is paired with a Tether. One is trained to command large quantities of aether for powerful offensives, and the other is trained to focus that energy, channel it, and keep it until control. Source and sink. My Tether's name was Phy. He used to call me his tide. ""You're boring, Lucien"", he would say. ""But you always get where you're going"". I lost Phy to a Portalborn a few months ago. I wasn't there. I should have been there. What am I without him? All finesse and nothing behind it. A tide with no waves, no force of ocean driving it forward. But there will always be another monster, and someone must rise to meet it. One step after another. As inevitable as the tide.",Southern Village
Reth,Force of Nature,5,Missing Half,5,M,,"Reveal your deck. Place up to two spells with the same name from your deck into your hand, and up to two spells with that same name from your discard pile into your hand. Return your deck in the same order.",,"0,2,3,3","C,C,C,56,S","C,C,C,S,S",,,Unbound Breach,,"Every mage in Azer has a Tether, right? That super special partner who they fight with and protect more than anyone else? The center of their universe? How special for them. I don't need that. Never have, never will, and I'm sick of everyone treating me like I'm fragile and damage just because I'm on my own. I liked being on my own. I'm strong like this. Who needs to channel aether when you can simply tear open a conduit and let the power overwhelm you? The teachers says I'm reckless. I say I get results. I used to have a Tether, way back when. If I focus really hard, I can even remember his face. Green hair. Pale eyes. He had a weird penchant for plants and a tendency to wander off into the woods for hours at a time. One day he wandered off and simply didn't come back. We hadn't even had our tattoos done yet. What was I supposed to do? A single mage abandoned by her Tether and left to create my own kind of magic. So I did. A magic more powerful because I didn't have some partner holding me back. I don't need guidelines, I don't need a Tether, and I definitely don't need anyone's help.",Southern Village
,,,,,,,,,,,,,,,,,
Legacy Mage 1 (Bow),,3,,,,,,,,,,,,,,,Legacy
Legacy Mage 2 (Sword),,3,,,,,,,,,,,,,,,Legacy
Legacy Mage 3 (Ram),,3,,,,,,,,,,,,,,,Legacy
Legacy Mage 4 (Staff),,3,,,,,,,,,,,,,,,Legacy
