# Name,Title,Complexity rating,Ability name,Charges,Type,Code,Ability,Special text,Starting Breach Positions,Hand,Deck,Special I,Special II,Special III,Special IV,Flavour,Box
Indira (WE),Breach Apprentice,9,Pyromancer's Guile,4,M,,Cast any number of spells in hand. Those spells each deal 1 additional damage. You may destroy a card in your discard pile.,,"9,9,3,9","C,C,C,1,S","C,C,C,2,S",,,,,"""Malastar was kind at least. He took my hand and bade me sit before he gently explained Brama's decision. It was a matter of the proper form, he said. I had not completed the entire apprentice's ordeal. I had not returned to Gravehold alone. Were I to be allowed to call myself a mage without completing the ordeal, other younglings might press for other exceptions. 'We cannot have any weakening of the customs of the mages, for the mages are too important to our survival', he told me.#But no, it would erode the faith of those around me to have to work with me, Brama said, and so it was for the best that I take my gem and my years of study and all the spells I had learned and go become a dirt merchant or sentry upon the balustrade.#That is what Brama said. But the truth is, it wasn't for lack of completing the ordeal. It was because she no longer trusted me. More precisely, she did not trust me upon returning in the company of Yan Magda.#So now, in a great irony, I study with Yan Magda. I listen to her tales, her time spent in between worlds. She speaks truths others dare not utter, and for this alone she was branded a heretic. And through her words I hone I skills.#How tragic that both women reach for the same goals, and yet cannot reach together.""",The Outer Dark
Remnant,Aethereal Entity,4,Ephemera Masque,5,M,,Any ally returns two cards in their discard pile to their hand.#OR#Gravehold gains 5 life.,,"0,4,4,3","3,C,C,S,S","C,C,C,C,S",,Aether Breach,,,"""Yan Magda insists I was once someone else. A man. A woman. Perhaps a child. I had a name and life that was somehow lost. She has explained that I am now but a fragment of my former self, a trick of the light given form and thought. A ghost in a world of those soon to follow. But I have no memory of who or what I was. I know only that I must persist.#It is always a struggle. Were I to have a body, I would likely describe the agony that is maintaining this form. I would likely fall to the cold ground and fill the world with my screams as I begin to unravel. But I feel nothing because I am nothing. There is no pain, only the urge to linger a little longer. I cannot depart, not yet.#So I sharpen what I think are my thoughts and force my way back into the world, to this dire place full of battered souls. I am needed here, whatever I may be, wherever this may be. My task remains unfulfilled. I must persist.""",The Outer Dark
,,,,,,,,,,,,,,,,,
Sahala,Oracle,3,Star Bind,4,Y,,"Reveal the top three cards of your deck. Place a spell revealed this way into your hand. If there are no spells prepped to your Celestial Breach, prep up to two spells in hand to your Celestial Breach.",,"0,2,4,4","C,C,C,1b5,S","C,C,C,S,S",,,,Celestial Breach,"I grew up on my father's stories of how Xaxos saved his life. My father would stretch his arms out wide, growling like a fanger stalker, and then grand my hand and pull me down low, pretending to cower in fear. He'd whisper dramatically about how far he was from Gravehold, all alone, with absolutely no hope of rescure. I would laugh, pull on his sleeve, jump up and down. You're not alone, Dad, look around the corner, Xaxos followed you. In my father's stories, Xaxos was always there, blasting his way through hordes of comical enemies. In real he was always around, practicing breach magic with my father, helping me with my own studies. I once asked Xaxos about the story, about how it actually went. He just knelt beside me and pointed at where my father was practicing, working the many facets of a shimmering stone. ""We retrieved that fallen star, Sahala. That is what is important. Power is often hidden in the cruelest of places. But that does not mean we have to be cruel to find it"". When Xaxos turned on the other mages, it broke my father's heart. He couldn't bring himself to choose between duty and love. So he chose neither and stepped down from his duties as a breach mage. I took the opposite path. If my father had opposed Xaxos, there was no guarantee he could have swayed his decision, but by doing nothing he made no difference at all. My father abandoned his friend by not taking that chance. Gravehold abandoned Xaxos's student when we cast them out. I will not abandon my brothers. I found the meteorite my father and Xaxos had recovered all those years ago collecting dust in our cellar. I use its power now, and I will fight where my father did not dare. I cannot believe that the Xaxos I knew is gone. He cannot be beyond saving.",The New Age
Gygar (NA),Tide Master,3,High Tide,5,M,,Place a Surge token on your Ancient Breach.#OR#Cast a spell prepped to your Ancient Breach. Gain 2 charges.,,"0,0,3,3","C,C,C,1b15,S","C,C,C,1b20,S",Ancient Breach,,,,"Old Gravehold and its unknown troves of power aren't lost. Nothing is lost until we stop looking for it. There are little cracks and pockets full of knowledge and treasure all over this world, and I'm the one who's gonna hunt them down. Years and years of rain filled up the tunnels we abandoned in The Fall, drowning ancient ruins and their manifold mysteries. Somewhere down there lie the sunken secrets forgotten by the modern children of New Gravehold, just waiting for me to rediscover them. The elders balked when I proposed an exploratory mission into the depths, shying away from adventure in favor of the known. For them, Old Gravehold is nothing but a memory of failure and loss. But I won't let emotion steer me away from discovery! I recruited Kadir to help me craft a spell for holding air, and her daughter Claudia insisted on joining my expedition below the surface. Claudia's focus may be scattered but her mind is keen and sharp. I needed her help maintaining her mother's spell to reach the deepest ruins. While swimming among the sunken stones, we found a strange necklace inside an unnatural pocket of air. We returned to the surface with it and I discovered it had the power to bend water to my will. More marvels just like it must be waiting below. Who knows what mysteries I - we - have yet to uncover. Our hunt for the unknown has only just begun.",The New Age
Taqren (NA),The Shield,2,Breach Siphon,4,M,,Focus any player's breach. Any player gains 1 life for each opened breach you have.,,"0,3,4,3","C,C,C,C,1b26","C,C,C,C,S",,,,Defender Breach (On Cast: Gravehold +1 life),"Danger unifies. Tragedy hardens. Desperation brings out the deepest strength in a person's soul. This is why the people of Gravehold cling like cockroaches to the surface of this world that hates us. I was a child when my mother, Z'hana, pulled me sobbing out of the collapsing tunnels. My father was in too deep, fighting to protect us against Maelstrom. I watched, helpless, as he vanished behind the rocks. I will always remember listening to my mother, the strongest person I know, crying herself to sleep. The next morning she sat me down and brushed the hair from my eyes. She said, ""I want to see you grow up in peace, my child, but our world does not know peace. I wish you could grow up feeling safe, but this city is not safe. Your father and I have tried to give you a better future, but we failed. I'm sorry, my love. All I can give you now is the strength to keep fighting. Succeed where we could not. Make this world a place where your children do not need to struggle to survive. Become strong, but do not become a weapon. Become their shield.""",The New Age
Claudia (NA),Prospector,5,Aeplosion,5,A,,"That ally gains 2$. The next time that ally gains a card from a supply pile this turn, you gain a copy of that card from that supply pile.#OR#That ally gains 5$.",,"9,4,3,1","C,C,C,C,1b36","C,C,C,C,S",,,,,"I was born with the mind of an artist and the spirit of an inventor. Or maybe the mind of a genius and the spirit of an even better genius! Not to brag, but I was only three years old when I shattered my first gem. All planned, of course. I wandered into my mom's workshop and banged into the leg of her work table. Dad made a fancy new lock for the door after that, probably to try and test my ingenuity. My dad's really smart like that. Must be where I get it from. Well, I solved his lock puzzle, I wiggled aether around inside until I cracked it. Dad kept making harder locks and I kept figuring them out, getting into mom's lab, and breaking things! I really owe it all to my parents. If they hadn't kept trying to stop me from getting places, I never would have gotten anywhere. Just like refining a diamond. My parents taught me to always seek to learn and to grow and evolve! Right now, we are standing on the shoulders of our foremothers and they are saying we're heavy and need to get off and walk on our own two feet! Everyone is so limited in imagination, our exploration of aether is held back only by our unwillingness to seek it out. We all know that aether is in gems, but it's also in EVERYTHING. This world IS aether! I am aether! Some people say I'm crazy, but I say this WORLD is crazy! It's time to start fighting fire with fire. Since I can feel my own aether, and everybody else's aether, I can control it with a level of detail no one has ever dreamed of before! So yeah, I'm a genius. My mom might be pretty proud of her emerald, but I'm the best gem she ever created.",The New Age
Rhia,Relic Hunter,6,Sublimate,4,M,,"Return a card in your hand or discard pile to its supply pile. If you returned a relic, gain a card from any supply pile that costs up to 3$ more than the returned card. Otherwise, gain a card from any supply pile that costs up to 2$ more than the returned card. Either way, place the gained card into your hand.",,"9,2,3,3","C,C,C,1d7,S","C,C,C,C,C",,,,,"When I was a kid I started losing my hair. No one knew what was happening, not even Brama. I was weak, bedridden for months. My folks figured I was gonna die, they cried over me while I drifted in and outta consciousness. They talked like I was already gone, sayin' how I'd be at peace now and all. Screw that. I've never been at peace my whole life. This whole world has never been at peace. Life is a battle and I'm not the givin' up type. Don't ask me how I found the strength but one night I got outta bed and stumbled into my dad's laboratory. I grabbed hold of one of the artifacts he'd been researching and poured every scrap of magical energy I had into it. I felt my skin changing and a tingle on my scalp. My hair began to grow back, strange and crystalline. Somehow, that infusion of breach magic fixed me. Brama has never stopped trying to find the secret to my healing. No one knows why I got sick or how I got better, or where my new hair comes from, but I don't care. Every day I walk on my own two feet is a day I stole from the Void. And I'm not done fighting yet.",The New Age
Soskel (NA),Aristocrat,4,Energized Sigil,4,M,,Place an Energize token on any player's breach that doesn't have one.#OR#Discard an Energize token on any player's breach. That player gains 4 life.,"When a player casts a spell from a breach that has an Energize token on it, that player gains 1 charge.","0,3,4,4","C,C,C,2b6,S","S,C,C,C,C",,,,,"It wasn't until Arachnos captured me and forced Void essence into my very soul that I understood what true power is. It's the potential to make a difference, to save those you love. My whole life I've only wanted to serve and protect Gravehold but I was never strong enough. It's my home, and its people are my family. As a youth, I carried crying children as we ran from The Fall, told them stories to help them sleep as we wandered the tunnels. I was a nobody, but I wanted to be useful. I had to defend what was left. After that day, I vowed to never again be so helpless. I needed to understand breach magic, but Mist said it was uncommon for an adult to become a mage initiate. I watched the children I had saved surpass me, become prodigious mages and burn brighter than I ever imagined. When Brama selected me as commander of an expedition to the north, I was shocked. My breach magic was certainly competent, but I was nowhere near as powerful as the mages she put under my leadership. I asked her why she chose me and Brama smiled. She said that while power is important, the true mark of a leader is understanding those he leads. It was this discipline, and my familiarity with loss, that let me survive the torture of Arachnos' ritual without forgetting myself. I have watched friends die too many times. This power may be corrupted, but if I can use it to help, I won't hold back.",The New Age
Talix (NA),The Chain,6,Soaring Ash,5,M,,"Destroy two sparks in hand. If you do, shuffle your turn order card into the turn order deck.#OR#Gravehold gains 5 life.",,"0,2,3,3","3b8,S,S,S,S","S,S,S,S,3b9",,,,,"It was kind of lonely growing up in Southpost. There weren't many kids my age to play with so I made my own fun by exploring the wilds. It was against the rules to go out alone, but that was what made it so fun. As the top dog of Southpost, my mom had more important things to do than keep a super close eye on me. So I spent a lot of time at home. Studying. Right next to a conveniently unlocked window. I knew it was stupid to wander around alone, but I was a kid. Kids are stupid. And I was still an idiot well into my adulthood. I never saw the point of growing up until I had a kid of my own. I found him, Inco, in some ancient ruins, curled up for warmth and half buried in vines that I later learned were part of him. I'm still amazed by how much power he holds in that tiny body of his. I suppose he'd have to be strong, growing up out in the wilds. It's crazy, I was the first other human he ever met in his whole life. It took a while to get him to trust me, but finally I convinced him to come back to Southpost with me. After a few months we moved to New Gravehold together so Inco could be around kids his own age. I know what it's like to feel alone, isolated from your people. As long as I'm here, Inco will never feel that way.",The New Age
Lost (NA),Living Forge,5,Meek's Might,5,M,,Return up to four cards that cost 0$ in your discard pile to your hand.,"Set aside all of the Forged Crystal and Forged Spark cards. These form the Forged deck. Cards in this deck can only be gained using Lost's Heart Forge. Forged Sparks and Forged Crystals count as Sparks and Crystals, respectively.","0,2,4,4","C,C,END2,S,S","C,C,C,S,S",,,,,"""After we defeated that massive wolf-like Nameless, we found this suit of armor hiding below ground. Lost managed to remember that he was a mage of Gravehold, but we don't know which mage, nor how he found himself bound to this suit of armor. During The Fall, the tunnels collapsed, which sealed off outposts and scouting parties. We never learned the fate of many breach mages during that time. Already some people treat Lost like a ghost returned from our unhappy past. Some, myself included, can't help but see him as a sign that all our missing friends might still be out there. I know it's foolish to get caught up in baseless hopes, but I still want to believe we could find just one more mage. After all, who knows how long Lost has been down there, waiting patiently for someone to come. Not knowing who he is, forging weapons he didn't know how to use. But I am hopeful. Each day, Lost's connection to us all grows stronger. Perhaps we may one day be able to reunite him with loved ones."" - Soskel",The New Age
Mazra (NA),The Reader,6,Research,4,M,,"Destroy a card with ""Mazra"" in its name in your hand. Gain a card with ""Mazra"" in its name from the personal upgrade deck that costs 3$ more than the destroyed card and place that card into your hand.#OR#Return to your hand all cards with ""Mazra"" in their name in your discard pile.","Set aside all cards with ""Mazra's"" in their name that cost more than 0$. These form Mazra's personal upgrade deck. Cards in this deck can only be gained using Mazra's Research ability.","0,4,3,4","C,C,C,C,1","C,C,C,C,2",,,Research Breach,,"""She'll probably deny it if you ask her, but I think Mazra might love books more than she loves me. She was born like two hours after me and she must have spent the entirety of that time in the womb growing her crazy huge brain. I'm no idiot, but Mazra was six when she gave Brama a ten-page petition to gain access to the Gravehold archives room. At just eight years old, she translated an ancient tome of breach magic and memorized spells no one had ever heard of. She was ten when she passed her ordeal and became the youngest breach mage ever. When I asked for toys she asked for textbooks. She used to follow Brama around and sneak into council meetings the way normal kids sneak out of school. We were only five years old when Mazra told me she was gonna be the next head of the council of elders. If it was any other kid I'd call them ridiculous, but if there's anyone who I trust to run Gravehold, it's my freak of a little sister."" - Razra",The Ancients
Qu (NA),Builder and Destroyer,8,Duality Embrace,5,M,,"If you are in Destroyer form, cast up to two different spells prepped by any number of players, and then flip over the Form token. Otherwise, any player preps up to two spells in their discard pile to their opened breaches, and then flip over the Form token.","Place the Form token on top of the mat with the Destroyer side faceup. All of the gems played and spells cast by Qu are affected by the faceup side of the Form token. The Form token can be flipped by using Qu's Duality Embrace ability or Change Form relic.#While in Destroyer Form, when you play a gem, gain 1 less $, to a minimum of 0. Spells you cast deal 1 additional damage.#While in Builder Form, when you play a gem, gain 1 additional $. Spells you cast deal 1 less damage, to a minimum of 0.","0,3,4,3","C,C,11,S,S","S,S,12,C,C",,,,,"Even though he was my father, I never really knew Xaxos. Not like some of his old friends here in Gravehold. Growing up, I could tell I was looking at the shell of a man. I was seeing someone desperately trying to piece himself back together, to regain something lost, to return to the man he was before. I never met the man my father was. The Void changes people. I should know, I lived my whole life there. I wonder, now, if the Nameless fight and kill because the very essence of their world drives them to it. Bloodlust permeates the air, twisting their minds. Or perhaps it is the emptiness, the barren nothing they are born into forces them into action. Growing up here, I understand what drives them towards the portals. The first time I saw a breach open I dropped everything. I didn't stop to think about my father, his research, our home, or my things. Everything paled in comparison to the potential to escape. I doubt he will ever even notice I am gone. Time is warped, it passes differently inside the Void. I don't know how old I am, or how long I have been gone, or where my place is in this strange world. But I know New Gravehold is beautiful. Humans are beautiful. Perhaps it is because of my humanity that I can control the Void energy that has consumed me my entire life. I've embraced my rage, channeled my hurt, and funneled my passion outward into strength. I will not let the Nameless have this world too, not when I have only just found it.",The Ancients
Nook (NA),Orb Caller,9,Condense Aether,5,M,,You may destroy a card in your hand or discard pile. Gain 4$. You may place the next spell you gain this turn into your hand.,,"9,9,3,9","C,C,C,C,1","C,C,C,C,2",,,,,"Give me a second to clear my thoughts. It gets harder and harder to tell this story in the proper order. Finally, when I ran out of breaches, the portal began pulling at me, pulling at my very mind. I wanted to see the other side. The more we could learn about the Void, I was sure, the better we could defend ourselves. After that, Indira trapped my little Void in a magical containment sphere. I thought I could create a simulation, a miniaturized Void breach, the kind the Nameless came through. The worst of them all was that the portal required energy, too much energy. I used to have a mind unparalleled in all of New Gravehold. Indira kept me together, afterwards. I opened breach after breach and the Void kept sucking them in, devouring their energy. If we could manufacture a Void portal, I believed I could peer through safely. At least I can use the sphere, now. I was a scientist. I would have died if Indira hadn't come in and stopped it. But it's not what I was before. I like to think I still am one, despite everything that I lost. To this day I do not know if I succeeded. I awoke without familiar breach magic, without many of my memories, without my mind. Initially, my research encountered many issues. Indira understands what it's like to have all of your energy concentrated in one place. More energy than I could muster. Time was scattered, messy, hard to grasp. I'll never be that again. Give me a second to clear my thoughts. It gets harder and harder to tell this story in the proper order.",Shattered Dreams
Inco (NA),Child of Green,4,Massive Growth,5,M,,Cast any number of Rose Thorns prepped by any number of players. Those spells deal 2 additional damage.,"Set aside all of the Rose Thorn cards. Those cards form the Rose Thorn deck. This is not a supply pile. Cards in this deck can be gained using Inco's Verdant Emerald. Additionally, Inco may spend 2$ to gain a card from this deck.","0,3,3,3","C,C,C,4,S","C,C,C,C,5",,,,,"The elders of Gravehold don't know what I am. I understand. For a long time I didn't know what I was either. My roots were planted deep in the wilds, nurtured by strange creatures with emerald eyes and thorny faces. I never considered it odd that my leaves were pinkish flesh instead of sturdy horns and hooves. I never thought about how I control the vines that interlace my body, or where they grew from. It was many years before my branches longed to stretch towards new suns, before my world of green and growth grew tiresome and repetitive. All trees need room to grow, but unlike most plants, I was not rooted. I was free to move and wander. For days I drifted, a lone leaf on the wind, seeking solace from tormenting storms. I took shelter in strange ruins and woke up face to face with a fleshy creature that looked just like me. It took many dawns for us to learn to communicate. Eventually I discovered he was something called a human named Talix. He took me home with him to Gravehold and treated me like his own child. There are so many of these humans, like twisting roses, all different hues, each more strange and beautiful than the last, but one here outshines them all. I lean always toward my radiant new sun, Razra. She and Talix and this forest of stone are strange beyond comprehension. I am still a stranger here. But I'm not afraid, because these are my people. As my new father told me: ""You're human, Inco. You're home.""",Into the Wild
Razra (NA),The Trainer,7,Train Rip,4,M,,"Destroy a card with ""Rip"" in its name in your hand. Gain a card with ""Rip"" in its name from the personal upgrade deck that costs 3$ more than the destroyed card and place that card into your hand.#OR#Return to your hand all cards with ""Rip"" in their name you have played this turn or are in your discard pile.","Set aside all card with ""Rip"" in their name that cost more than 0$. These form Razra's personal upgrade deck. Cards in this deck can only be gained using Razra's Train Rip ability.","0,3,4,4","C,C,C,32,S","C,C,C,33,S",,,,,"""Razra and I may be identical but we couldn't be more different. She's always taken the fact that we live in a jungle full of deadly monsters as more of a challenge than something to fear. She was the sort of child who would break her leg jumping off the roof, and before it even healed, jump off again because now she's sure she's perfected the landing. I think these days the dirt might be so deeply ingrained in her skin that it won't ever come off. It's no wonder she's so close with that strange forest boy, Inco. I'll admit, I worried about her for a long time. We had both always wanted to become breach mages. While it came naturally to me, Razra struggled. She wouldn't focus on a book, couldn't sit through a lesson. Then, as if it was sent for her, that strange creature wandered close to the city. No normal person would even care, but my sister has never been normal. She threw herself into befriending this creature, named it Rip, and trained it beyond what anyone had assumed possible. It was miraculous. With Rip by her side Razra grew quickly in strength, racing through her training at unprecedented speeds. Finally, she joined me as a full fledged breach mage. I was starting to get bored waiting for her to catch up."" - Mazra",Into the Wild
,,,,,,,,,,,,,,,,,
